id;description
1;"Поздравляю, вы не похожи на больного! побольше спите"
5;"Мы не знаем"
2;"Железодефицитная анемия (ЖДА) — это клинико гематологический синдром , характеризующийся нарушением синтеза гемоглобина в результате дефицита синтеза железа, на фоне различных патологических процессов. Причины: Нарушение поступления в организм железа: алиментарная недостаточность Повышенное потребление в организме железа : хеонические кровотечения , анемия хронических заболевании, беременность и лактация, следствие бурного роста ребенка. Нарушение усвоения в организме железа в 12 п.к. и тощей: ахлоргидрия, резекция целиакия.Поиск причины и ее устранение Препараты железа внутрь (2х или 3х валентное железо) Диета с содержанием мясных продуктов Не следует прибегать к трансфузиям эритроцитов Показанием для переливания эритроцитов является не уровень гемоглобина , а состояние больного, его гемодинамика"
3;"Мегалобластные анемии - группа анемий , характеризующаяся накоплением в костном мозге измененных эритроидных предшественников - мегалобластов, в котрых в следствии нарушения синтеза ДНК нарушаются процессы созревания и дифференцировки. Более из-за дефицита витамина В12 - цианкобаламин и В9, другие причины - врожденные заболевания с нарушением синтеза ДНК и прием препаратов. Поиск причины и ее устранение Витамин В12 Фолиевая кислота"
4;"Гемолитические анемии - гетерогенная группа анемий, характеризующаяся укорочением жизни эритроцитов на фоне сохраненной функции КМ. Гемолитические анемии могут быть врожденными и приобретенными. Гемолиз бывает внутрисосудистым u внесосудистым(печень,селезенка,КМ) (900/0) Единственным методом лечения наследственным микросфероцитозом является спленэктомия, которая оказывается эффективной в 100 % случаях. После спленэктомии у больных наступает практическое излечение, несмотря на то, что эритроциты сохраняют свои патологические свойства."